{"checklist_id":"20260101-02-freeze-vtest","projeto":"fixture-teste","versao_alvo":"VTEST","bloqueadores_abertos":0,"criterios":[{"id":"criterio-a","descricao":"ok normal","obrigatorio":true,"status":"ok","evidencia":"fixture"},{"id":"criterio-na","descricao":"não se aplica neste perfil","obrigatorio":true,"status":"na","justificativa":"não se aplica; exceção coberta pelo hearback guards/tests/fixtures/hearbacks/confirmado-com-excecao.json"}],"atualizado_por":"fixture-teste","atualizado_em":"2026-06-10T00:00:00-03:00"}
